{
  "$schema": "../score_v2_predictive_week.schema.json",
  "as_published_observation": {
    "dxy_weekly_level": 101.77899932861328,
    "score": -0.4710321332052917
  },
  "frozen_predictions": {
    "always_up_direction": "up",
    "model_direction": "down",
    "momentum_direction": "down",
    "momentum_prior_dxy_level": 102.23100280761719,
    "momentum_prior_source": "previous_predictive_week_record",
    "momentum_prior_week": "2026-10-09"
  },
  "implementation_contract_sha256": "13c2b546abda5c7ba44bdf178371346062d6717c1ed7f10f6a16aac319a9f789",
  "locked_preregistration_commit_sha": "89bf56bafd594987176f31efaa926ecf02228289",
  "locked_preregistration_file_sha256": "36accc42e4915bb48caa1c4d2fd0fac8ba27c51c0eb988916990c415830e3ca0",
  "predictive_power_status": "not_established_pending_52_resolved_predictions",
  "production_change": false,
  "record_role": "predictive_origin",
  "record_schema_version": 1,
  "recorded_at_utc": "2026-10-17T10:45:24.050729+00:00",
  "research_only": true,
  "source_v2_bundle": {
    "attestation_run_id": 39026016627,
    "attestation_status": "passed",
    "attestation_url": "https://github.com/usdimpact/usd-impact-pipeline/actions/runs/39026016627",
    "pipeline_commit_sha": "0be6a771e984a09b4ca1793c762f296a7d4dc2ca",
    "sha256": "82458aaf73fb5a82fec5b68498e71b03c758cf15be2f58a58df17b3468403628"
  },
  "study": "usd_impact_score_v2_one_week_dxy_direction_2026-08-25",
  "week": "2026-10-16"
}
