{
  "$schema": "../score_v2_predictive_week.schema.json",
  "as_published_observation": {
    "dxy_weekly_level": 99.69999694824219,
    "score": -0.6910878223615368
  },
  "frozen_predictions": {
    "always_up_direction": "up",
    "model_direction": "down",
    "momentum_direction": "up",
    "momentum_prior_dxy_level": 98.8000030518,
    "momentum_prior_source": "frozen_2026-08-21_initialization",
    "momentum_prior_week": "2026-08-21"
  },
  "implementation_contract_sha256": "13c2b546abda5c7ba44bdf178371346062d6717c1ed7f10f6a16aac319a9f789",
  "locked_preregistration_commit_sha": "89bf56bafd594987176f31efaa926ecf02228289",
  "locked_preregistration_file_sha256": "36accc42e4915bb48caa1c4d2fd0fac8ba27c51c0eb988916990c415830e3ca0",
  "predictive_power_status": "not_established_pending_52_resolved_predictions",
  "production_change": false,
  "record_role": "predictive_origin",
  "record_schema_version": 1,
  "recorded_at_utc": "2026-08-29T22:07:56.742573+00:00",
  "research_only": true,
  "source_v2_bundle": {
    "attestation_run_id": 33277480141,
    "attestation_status": "passed",
    "attestation_url": "https://github.com/usdimpact/usd-impact-pipeline/actions/runs/33277480141",
    "pipeline_commit_sha": "5bc1a6bb1575b7a8d9268219bb72bcdf42d974b6",
    "sha256": "60f75ec0265d159c92e5584f425a1a881e2b4c3799bed43cb8f5bb40c188a96b"
  },
  "study": "usd_impact_score_v2_one_week_dxy_direction_2026-08-25",
  "week": "2026-08-28"
}
